{
  "$schema": "../src/overview/deck-blueprint.schema.json",
  "deck": {
    "title": "A focused service model can reduce resolution time by 30%",
    "audience": "Executive operating committee",
    "purpose": "Approve a 90-day pilot",
    "deliveryMode": "pre-read",
    "outputFormats": ["pptx", "google-slides"],
    "governingThought": "Routing high-frequency cases to specialized teams can reduce resolution time while protecting service quality."
  },
  "theme": {
    "aspectRatio": "16:9",
    "referenceDeck": null,
    "fontFamily": "Arial",
    "accentColor": "#0057B8"
  },
  "story": {
    "chapters": [
      "The case for change",
      "The proposed model",
      "Pilot and decision"
    ]
  },
  "slides": [
    {
      "number": 1,
      "id": "title",
      "chapter": "The case for change",
      "archetype": "title",
      "actionTitle": "A focused service model can reduce resolution time by 30%",
      "primaryClaim": "The proposed model concentrates expertise on the cases that drive most delays.",
      "dominantExhibit": "minimal-title",
      "evidence": [],
      "sources": [],
      "implication": "The committee should evaluate the proposal as a speed-and-quality intervention.",
      "speakerNotes": "Open with the decision required at the end of the meeting."
    },
    {
      "number": 2,
      "id": "executive-synthesis",
      "chapter": "The case for change",
      "archetype": "executive-synthesis",
      "actionTitle": "Three operational shifts make a 90-day pilot both valuable and controllable",
      "primaryClaim": "Specialization, routing rules, and weekly governance are the minimum viable pilot system.",
      "dominantExhibit": "three-row-synthesis",
      "evidence": [
        {
          "claim": "A small set of case types accounts for most avoidable delay.",
          "status": "illustrative"
        }
      ],
      "sources": [],
      "implication": "Approve a bounded pilot rather than a broad transformation.",
      "speakerNotes": "Replace illustrative evidence with validated client data before delivery."
    },
    {
      "number": 3,
      "id": "resolution-time",
      "chapter": "The case for change",
      "archetype": "chart-led-insight",
      "actionTitle": "Two case categories account for most excess resolution time",
      "primaryClaim": "Targeting the two largest delay contributors creates the highest-value starting point.",
      "dominantExhibit": "sorted-horizontal-bar",
      "chartType": "bar",
      "evidence": [
        {
          "claim": "Categories A and B contribute 64% of excess hours.",
          "status": "verified"
        }
      ],
      "sources": [
        {
          "label": "Operations case log, Q2 sample",
          "location": "data/case-log.csv"
        }
      ],
      "implication": "Limit the initial specialist teams to the two highest-impact categories.",
      "speakerNotes": "State the sample definition and calculation method."
    }
  ]
}
